{
  "version": 2,
  "t": "Advanced Chart Coverage",
  "s": "Compact v2 coverage for non-geographic, non-image chart families.",
  "theme": "executive-clean",
  "density": "compact",
  "d": [
    [
      "series",
      [
        ["category", "s"],
        ["period", "d"],
        ["value", "n"],
        ["value_b", "n"],
        ["value_c", "n"],
        ["group", "s"],
        ["size", "n"],
        ["lower", "n"],
        ["upper", "n"],
        ["start", "d"],
        ["end", "d"],
        ["open", "n"],
        ["high", "n"],
        ["low", "n"],
        ["close", "n"],
        ["label", "s"],
        ["q1", "n"],
        ["median", "n"],
        ["q3", "n"],
        ["min", "n"],
        ["max", "n"],
        ["target", "n"],
        ["range_1", "n"],
        ["range_2", "n"],
        ["range_3", "n"]
      ],
      [
        ["Alpha", "2026-01-01", 22, 18, 12, "North", 40, 18, 27, "2026-01-01", "2026-01-12", 20, 26, 17, 24, "A", 18, 22, 25, 15, 29, 25, 15, 22, 30],
        ["Beta", "2026-02-01", 31, 24, 18, "South", 55, 26, 36, "2026-01-08", "2026-01-20", 24, 34, 22, 30, "B", 25, 30, 34, 21, 39, 33, 20, 30, 40],
        ["Gamma", "2026-03-01", 27, 29, 21, "North", 48, 21, 33, "2026-01-15", "2026-01-30", 30, 35, 25, 28, "C", 22, 27, 31, 19, 37, 30, 18, 28, 38],
        ["Delta", "2026-04-01", 38, 33, 25, "South", 70, 32, 44, "2026-01-25", "2026-02-10", 28, 41, 27, 39, "D", 31, 37, 41, 26, 47, 40, 25, 36, 48]
      ]
    ]
  ],
  "v": [
    ["ln", 0, 1, [2, 3], {"pt": true, "sel": "hover", "t": "Line"}],
    ["ar", 0, 1, [2, 3], {"st": "zero", "t": "Stacked Area"}],
    ["tr", 0, 1, 2, 6, 5, {"t": "Trail"}],
    ["reg", 0, 2, 3, 5, "linear", {"t": "Regression"}],
    ["bar", 0, 0, [2, 3], {"or": "v", "sel": "click", "t": "Grouped Bar"}],
    ["gantt", 0, 0, 9, 10, 5, {"t": "Gantt"}],
    ["water", 0, 0, 2, {"t": "Waterfall"}],
    ["bullet", 0, 0, 2, 21, [22, 23, 24], {"t": "Bullet"}],
    ["range", 0, 0, 7, 8, {"t": "Ranged Dot"}],
    ["hist", 0, 2, {"bn": 12, "t": "Histogram"}],
    ["den", 0, 2, 5, {"sel": "legend", "t": "Density"}],
    ["dot", 0, 2, null, {"mode": "rug", "t": "Rug"}],
    ["box", 0, 5, 2, {"t": "Box Plot"}],
    ["box5", 0, 0, 19, 16, 17, 18, 20, {"t": "Summary Box Plot"}],
    ["qq", 0, 2, 3, {"t": "QQ"}],
    ["sc", 0, 2, 3, 5, 6, {"t": "Bubble"}],
    ["par", 0, [2, 3, 4], 5, {"t": "Parallel Coordinates"}],
    ["tri", 0, 2, 3, 4, 15, {"t": "Ternary"}],
    ["heat", 0, 0, 5, 2, {"t": "Heatmap"}],
    ["mos", 0, 0, 5, 2, {"t": "Mosaic"}],
    ["pie", 0, 0, 2, {"t": "Pie"}],
    ["don", 0, 0, 2, {"t": "Donut"}],
    ["rad", 0, 0, 2, {"t": "Radial"}],
    ["err", 0, 0, 7, 8, 2, {"t": "Error Bar"}],
    ["band", 0, 1, 7, 8, 2, {"t": "Error Band"}],
    ["candle", 0, 1, 11, 12, 13, 14, {"t": "Candlestick"}],
    ["text", 0, 2, 3, 15, {"t": "Text Plot"}],
    ["tick", 0, 2, 5, {"t": "Tick Plot"}],
    ["rule", 0, 2, 3, 4, 6, {"t": "Rule Plot"}],
    ["layer", [["sc", 0, 2, 3], ["reg", 0, 2, 3, null, "linear"]], {"t": "Layered Regression"}],
    ["facet", ["ln", 0, 1, [2]], 5, null, {"t": "Faceted Line"}],
    ["concat", "h", [["bar", 0, 0, [2]], ["sc", 0, 2, 3]], {"t": "Concatenated Views"}],
    ["repeat", ["ln", 0, 1, [2]], [2, 3, 4], "h", {"t": "Repeated Measures"}],
    ["ln", 0, 1, [2], {"ip": "step", "t": "Step Line"}],
    ["ln", 0, 1, [2], {"mode": "slope", "t": "Slope Graph"}],
    ["ln", 0, 1, [2, 3], {"mode": "bump", "t": "Bump Chart"}],
    ["ar", 0, 1, [2, 3], {"st": "center", "mode": "stream", "t": "Streamgraph"}],
    ["ar", 0, 1, [2], {"mode": "horizon", "t": "Horizon Area"}],
    ["bar", 0, 0, [2, 3], {"st": "normalize", "t": "Normalized Bar"}],
    ["bar", 0, 0, [2], {"mode": "diverging", "t": "Diverging Bar"}],
    ["dot", 0, 2, null, {"mode": "strip", "jitter": true, "t": "Strip Plot"}],
    ["heat", 0, 2, 3, {"bn": [8, 8], "t": "2D Histogram"}],
    ["sc", 0, 2, 3, 5, 6, {"sel": "brush", "t": "Brush Scatter"}],
    ["ln", 0, 1, [2], {"sel": "zoom", "t": "Zoomable Line"}],
    ["r", 0]
  ]
}
